### ISSUE TITLE
planHardenedInboundACL: add tcp/22 to the hardcoded discard set

### ISSUE THREAD

**Issue by pau-hedgehog** [githedgehog/fabric#1448]
The hardcoded inbound-ACL the agent injects on every non-proxied external attachment via `planHardenedInboundACL` discards management-daemon traffic to the leaf's own L3 interface IP for five ports today: TCP/443, TCP/8080, UDP/67, UDP/161, UDP/4789. TCP/22 (sshd) is excluded from this set, so the only thing preventing external BGP peers (and anything else routable to the leaf's external-facing IP) from reaching the leaf's SSH listener is the host-stack iptables `REJECT --reject-with tcp-reset` rule installed by `prepareSONiC`.

iptables hardening is a single layer of defense. Silicon-tier discard is the recommended Broadcom mechanism for management-daemon ports on front-panel L3 interfaces (confirmed by Broadcom support: "manually configure ACL discard rule (neither forward nor trap to CPU) under an interface-level or system level for all front-panel ports"). The other five ports already use that mechanism. SSH should match.

## Repro: SSH listener is reachable when iptables is removed

Captured on env-4 / `s5248-08` (Dell S5248F-ON, fabric `v0.120.1`) during a controlled experiment that temporarily deleted the `prepareSONiC` iptables REJECT for tcp/22:

```
$ ./hhfab-acl-v9 vlab ssh -bn s5248-08 -- 'sudo iptables -D INPUT -i Vrf+ -p tcp -m tcp --dport 22 -j REJECT --reject-with tcp-reset'
```

```
$ ./hhfab-acl-v9 vlab ssh -bn virt-external -- "sudo ip vrf exec acl-test bash -c 'nc -zvw3 100.99.100.2 22'"
```

```
Connection to 100.99.100.2 22 port [tcp/ssh] succeeded!
```

```
$ ./hhfab-acl-v9 vlab ssh -bn s5248-08 -- 'sudo timeout 8 tcpdump -i Eth1.100 -n -c 20 tcp port 22'
```

```
listening on Eth1.100, link-type EN10MB (Ethernet), snapshot length 262144 bytes
17:24:55.894552 IP 100.99.100.6.41542 > 100.99.100.2.22: Flags [S], seq 2310539291, win 64240, ...
17:24:55.894623 IP 100.99.100.2.22 > 100.99.100.6.41542: Flags [S.], seq 2322619851, ack 909190670, ...
17:24:55.894845 IP 100.99.100.6.41542 > 100.99.100.2.22: Flags [.], ack 1, win 502, ...
17:24:55.895171 IP 100.99.100.6.41542 > 100.99.100.2.22: Flags [F.], seq 1, ack 1, win 502, ...
17:24:55.899291 IP 100.99.100.2.22 > 100.99.100.6.41542: Flags [.], ack 2, win 124, ...
17:24:55.974940 IP 100.99.100.2.22 > 100.99.100.6.41542: Flags [P.], seq 1:41, length 40: SSH: SSH-2.0-OpenSSH_8.4p1 Debian-5+deb11u4
17:24:55.975272 IP 100.99.100.6.41542 > 100.99.100.2.22: Flags [R], seq 909190671, win 0, length 0
```

Full TCP three-way handshake completed; sshd returned its banner. With iptables REJECT in place, `nc` reports "Connection refused" (host-stack RST) instead. Silicon never sees a `discard` rule for tcp/22, so the SYN reaches the host stack on every probe.

(iptables REJECT was restored immediately after the capture; the leaf is back to its hardened state.)

## Listener inventory on the leaf

Ports listening on `0.0.0.0` or wildcard, observable from a front-panel L3 interface:

```
$ ./hhfab-master vlab ssh -bn s5248-08 -- 'sudo ss -tnlp'
```

```
LISTEN 0 128                 0.0.0.0:22         sshd
LISTEN 0 512                 0.0.0.0:179        bgpd          (intentional, BGP peering)
LISTEN 0 512                       *:443        rest_server   (in hardcoded set)
LISTEN 0 512                       *:8080       telemetry     (in hardcoded set)
```

```
$ ./hhfab-master vlab ssh -bn s5248-08 -- 'sudo ss -unlp'
```

```
UNCONN 0 0                   0.0.0.0:161        snmpd          (in hardcoded set)
UNCONN 0 0               172.30.0.12:123        ntpd           (mgmt IP only, not on external VRF)
```

(UDP/67 dhcrelay and UDP/4789 VXLAN are kernel-side hooks not visible in `ss`; both are already in the hardcoded set.)

TCP/22 is the only externally-reachable listener that is not already either in the hardcoded set or by-design exposed.
